{
  "schema_version":"1.0","category":"bakery","run_id":"fixture-bakery","generated_at":"2026-07-18T00:00:00Z",
  "source_artifacts":{"manifest":"00-run-manifest.md","evidence":"05-evidence-ledger.md"},
  "records":[
    {"id":"BAK-001","name":"North Star Bread","aliases":[],"branch":null,"address":"123 Main St, Example, UT","coordinates":{"lat":40.75,"lng":-111.88},"disposition":"rated-survivor","reason":"Scratch bread and accepted rating","score":{"s":82,"i":66,"g":73.56,"provenance":"documented"},"rating":{"value":4.7,"count":125,"count_state":"literal","platform":"Google","provenance":"direct","accessed_at":"2026-07-18"},"tier":"A","ranking_eligible":true,"occasions":["best-bread"],"rare_finds":[],"access":{"format":"storefront","state":"walk-in active","evidence_date":"2026-07-18"},"merge_target":null,"rationale":["Naturally leavened bread is made in house."],"sources":[{"artifact":"05-evidence-ledger.md","ref":"BAK-001"}]},
    {"id":"BAK-002","name":"Moonrise Microbakery","aliases":[],"branch":null,"address":null,"coordinates":null,"disposition":"rating-unconfirmed","reason":"Scratch verified; rating unavailable","score":{"s":76,"i":72,"g":73.95,"provenance":"documented"},"rating":null,"tier":null,"ranking_eligible":false,"occasions":["cross-town"],"rare_finds":["regional-bun"],"access":{"format":"home microbakery","state":"preorder active","evidence_date":"2026-07-17"},"merge_target":null,"rationale":["Active weekly preorder."],"sources":[{"artifact":"05-evidence-ledger.md","ref":"BAK-002"}]},
    {"id":"BAK-003","name":"Old Mill Bakery","aliases":[],"branch":null,"address":"9 Mill Rd, Example, UT","coordinates":{"lat":40.70,"lng":-111.90},"disposition":"status-deferred","reason":"Current acquisition path unverified","score":{"s":70,"i":50,"g":59.16,"provenance":"estimated"},"rating":{"value":4.5,"count":40,"count_state":"literal","platform":"Google","provenance":"direct","accessed_at":"2026-07-16"},"tier":null,"ranking_eligible":false,"occasions":[],"rare_finds":[],"access":{"format":"storefront","state":"unverified","evidence_date":"2026-07-16"},"merge_target":null,"rationale":[],"sources":[{"artifact":"05-evidence-ledger.md","ref":"BAK-003"}]}
  ]
}
